{
  "id": 39,
  "topic": "Business Ethics",
  "topicCN": "商业伦理",
  "category": "Economy",
  "vocabulary": [
    {
      "word": "corporate ethics",
      "ipa": "/ˌkɔːpərət ˈeθɪks/",
      "meaning": "企业伦理",
      "collocation": "establish clear standards of corporate ethics",
      "collocationCN": "确立明确的企业伦理标准"
    },
    {
      "word": "corporate accountability",
      "ipa": "/ˌkɔːpərət əˌkaʊntəˈbɪləti/",
      "meaning": "企业问责",
      "collocation": "strengthen corporate accountability",
      "collocationCN": "加强企业问责"
    },
    {
      "word": "conflict of interest",
      "ipa": "/ˌkɒnflɪkt əv ˈɪntrəst/",
      "meaning": "利益冲突",
      "collocation": "declare a potential conflict of interest",
      "collocationCN": "申报潜在利益冲突"
    },
    {
      "word": "whistle-blower",
      "ipa": "/ˈwɪsəlˌbləʊə/",
      "meaning": "举报人；揭弊者",
      "collocation": "protect a whistle-blower from retaliation",
      "collocationCN": "保护举报人免遭报复"
    },
    {
      "word": "due diligence",
      "ipa": "/ˌdjuː ˈdɪlɪdʒəns/",
      "meaning": "尽职调查",
      "collocation": "conduct thorough due diligence",
      "collocationCN": "开展全面的尽职调查"
    },
    {
      "word": "supply-chain transparency",
      "ipa": "/səˌplaɪ tʃeɪn trænsˈpærənsi/",
      "meaning": "供应链透明度",
      "collocation": "improve supply-chain transparency",
      "collocationCN": "提高供应链透明度"
    },
    {
      "word": "ethical sourcing",
      "ipa": "/ˌeθɪkəl ˈsɔːsɪŋ/",
      "meaning": "合乎道德的采购",
      "collocation": "adopt an ethical-sourcing policy",
      "collocationCN": "采用合乎道德的采购政策"
    },
    {
      "word": "fair-trade certification",
      "ipa": "/ˌfeə treɪd ˌsɜːtɪfɪˈkeɪʃən/",
      "meaning": "公平贸易认证",
      "collocation": "obtain fair-trade certification",
      "collocationCN": "取得公平贸易认证"
    },
    {
      "word": "greenwashing",
      "ipa": "/ˈɡriːnwɒʃɪŋ/",
      "meaning": "漂绿；虚假环保宣传",
      "collocation": "challenge misleading greenwashing claims",
      "collocationCN": "质疑误导性的漂绿宣传"
    },
    {
      "word": "consumer trust",
      "ipa": "/kənˌsjuːmə ˈtrʌst/",
      "meaning": "消费者信任",
      "collocation": "rebuild consumer trust",
      "collocationCN": "重建消费者信任"
    },
    {
      "word": "data privacy",
      "ipa": "/ˈdeɪtə ˌprɪvəsi/",
      "meaning": "数据隐私",
      "collocation": "safeguard customers’ data privacy",
      "collocationCN": "保护客户的数据隐私"
    },
    {
      "word": "anti-competitive practice",
      "ipa": "/ˌænti kəmˈpetɪtɪv ˌpræktɪs/",
      "meaning": "反竞争行为",
      "collocation": "investigate anti-competitive practices",
      "collocationCN": "调查反竞争行为"
    },
    {
      "word": "bribery",
      "ipa": "/ˈbraɪbəri/",
      "meaning": "行贿受贿",
      "collocation": "implement strict anti-bribery controls",
      "collocationCN": "实施严格的反贿赂管控"
    },
    {
      "word": "exploitative labour",
      "ipa": "/ɪkˌsplɔɪtətɪv ˈleɪbə/",
      "meaning": "剥削性劳动",
      "collocation": "remove exploitative labour from supply chains",
      "collocationCN": "消除供应链中的剥削性劳动"
    },
    {
      "word": "code of conduct",
      "ipa": "/ˌkəʊd əv ˈkɒndʌkt/",
      "meaning": "行为准则",
      "collocation": "enforce a supplier code of conduct",
      "collocationCN": "执行供应商行为准则"
    },
    {
      "word": "cut corners",
      "ipa": "/kʌt ˈkɔːnəz/",
      "meaning": "为省钱省时而偷工减料",
      "collocation": "refuse to cut corners on product safety",
      "collocationCN": "拒绝在产品安全上偷工减料"
    },
    {
      "word": "turn a blind eye",
      "ipa": "/tɜːn ə ˌblaɪnd ˈaɪ/",
      "meaning": "对问题视而不见",
      "collocation": "turn a blind eye to unsafe conditions",
      "collocationCN": "对不安全的工作条件视而不见"
    },
    {
      "word": "do the right thing",
      "ipa": "/duː ðə ˌraɪt ˈθɪŋ/",
      "meaning": "做正确且合乎道德的事",
      "collocation": "do the right thing despite the cost",
      "collocationCN": "即使有成本也坚持做正确的事"
    },
    {
      "word": "hold a company to account",
      "ipa": "/həʊld ə ˌkʌmpəni tər əˈkaʊnt/",
      "meaning": "追究公司的责任",
      "collocation": "hold a company to account for misconduct",
      "collocationCN": "追究公司的不当行为责任"
    },
    {
      "word": "live up to a promise",
      "ipa": "/lɪv ʌp tə ə ˈprɒmɪs/",
      "meaning": "兑现承诺",
      "collocation": "live up to public sustainability promises",
      "collocationCN": "兑现公开的可持续发展承诺"
    }
  ],
  "paraphrases": [
    {
      "base": "honest business behaviour",
      "options": [
        "ethical conduct",
        "responsible commercial practice",
        "business integrity"
      ],
      "note": "integrity 强调持续诚信。"
    },
    {
      "base": "tell customers important facts",
      "options": [
        "disclose material information",
        "provide meaningful transparency",
        "present key conditions clearly"
      ],
      "note": "material 指会影响决定的重要信息。"
    },
    {
      "base": "hidden extra cost",
      "options": [
        "undisclosed fee",
        "compulsory additional charge",
        "opaque pricing"
      ],
      "note": "opaque 表示不透明难理解。"
    },
    {
      "base": "mislead people",
      "options": [
        "create a false impression",
        "use deceptive presentation",
        "distort consumer understanding"
      ],
      "note": "deceptive 比 unclear 更强。"
    },
    {
      "base": "supplier working conditions",
      "options": [
        "labour conditions in the supply chain",
        "contractor employment practices",
        "upstream workplace standards"
      ],
      "note": "upstream 指供应链前端。"
    },
    {
      "base": "check business risks",
      "options": [
        "exercise due diligence",
        "investigate foreseeable harm",
        "audit high-risk operations"
      ],
      "note": "due diligence 强调合理调查义务。"
    },
    {
      "base": "answer for harm",
      "options": [
        "be held accountable",
        "accept corporate responsibility",
        "provide an effective remedy"
      ],
      "note": "remedy 指补救。"
    },
    {
      "base": "personal interest affects duty",
      "options": [
        "conflict of interest",
        "competing private incentive",
        "compromised impartiality"
      ],
      "note": "conflict 可存在而不等于已经腐败。"
    }
  ],
  "sentences": [
    {
      "pattern": "A practice may be legal while still + ethical concern + because + reason.",
      "cn": "某做法可能合法，却仍存在伦理问题，因为……。",
      "example": "A practice may be legal while still being unfair because customers cannot understand its consequences."
    },
    {
      "pattern": "The more difficult + information + is to verify, the greater the responsibility of + business + to + action.",
      "cn": "信息越难核实，企业就越有责任……。",
      "example": "The more difficult a safety claim is to verify, the greater the responsibility of a business to provide evidence."
    },
    {
      "pattern": "Had + company + disclosed + fact earlier, + stakeholders + could have + informed action.",
      "cn": "如果公司更早披露某事实，利益相关者本可以……。",
      "example": "Had the company disclosed the fee earlier, customers could have compared the offers accurately."
    }
  ],
  "expressions": [
    {
      "text": "act in good faith",
      "cn": "诚信行事",
      "example": "Both sides are expected to act in good faith."
    },
    {
      "text": "turn a blind eye to",
      "cn": "对……视而不见",
      "example": "Managers must not turn a blind eye to unsafe suppliers."
    },
    {
      "text": "be transparent about costs",
      "cn": "对成本保持透明",
      "example": "Platforms should be transparent about additional costs."
    },
    {
      "text": "hold a company accountable",
      "cn": "追究企业责任",
      "example": "Independent reporting can hold a company accountable."
    },
    {
      "text": "create a conflict of interest",
      "cn": "造成利益冲突",
      "example": "Accepting the gift could create a conflict of interest."
    }
  ],
  "mistakes": [
    {
      "wrong": "The company cheated its customers to pay more.",
      "correct": "The company misled its customers into paying more.",
      "why": "mislead somebody into doing 是自然结构。"
    },
    {
      "wrong": "This behaviour is lack of ethics.",
      "correct": "This behaviour is unethical.",
      "why": "be lack of 不成立；用形容词 unethical。"
    },
    {
      "wrong": "They should be responsible of the damage.",
      "correct": "They should be responsible for the damage.",
      "why": "responsible for 是固定搭配。"
    }
  ],
  "writingIdeas": [
    {
      "viewpoint": "Ethical disclosure must be understandable, not merely available.",
      "topicSentence": "Businesses should present material risks and costs in a form that ordinary customers can use.",
      "collocations": [
        "disclose material information",
        "use plain language",
        "make an informed decision",
        "avoid misleading claims"
      ],
      "argument": "A long legal document may technically contain a fee while ensuring that few customers notice it. Ethical communication gives important conditions appropriate prominence and explains consequences in plain language. This is especially necessary when the seller understands the product far better than the buyer. Standardised summaries can support comparison without removing detailed terms. Transparency should be judged by informed choice, not by the existence of a hidden link."
    },
    {
      "viewpoint": "Supply-chain responsibility cannot end at the first contractor.",
      "topicSentence": "Companies that benefit from outsourced production should investigate serious labour and environmental risks.",
      "collocations": [
        "audit a supply chain",
        "set minimum standards",
        "remedy a violation",
        "exercise due diligence"
      ],